{
  "$schema": "https://json-schema.org/draft/2020-12/schema",
  "$id": "urn:world-studio:proposal:world_studio.task_profile.v0.1",
  "title": "World Studio Task Profile v0.1",
  "description": "Design proposal only. Defines a task envelope, validation metrics, and safety constraints. It cannot authorize real robot execution without compatible validated world and robot profiles.",
  "type": "object",
  "additionalProperties": false,
  "required": [
    "schema",
    "task_id",
    "version",
    "created_at",
    "lifecycle_status",
    "domain",
    "units",
    "world",
    "robot_profile",
    "world_frame",
    "objective",
    "start_state",
    "goals",
    "constraints",
    "failure_criteria",
    "metrics",
    "task_envelope",
    "requirements",
    "authority",
    "provenance"
  ],
  "properties": {
    "schema": {
      "const": "world_studio.task_profile.v0.1"
    },
    "task_id": {
      "$ref": "#/$defs/identifier"
    },
    "version": {
      "type": "integer",
      "minimum": 1,
      "maximum": 2147483647
    },
    "created_at": {
      "$ref": "#/$defs/timestamp"
    },
    "lifecycle_status": {
      "enum": [
        "draft",
        "proposal",
        "validated",
        "promoted",
        "held",
        "rejected"
      ]
    },
    "domain": {
      "enum": [
        "indoor_navigation",
        "indoor_cleaning",
        "outdoor_navigation",
        "aerial_navigation",
        "inspection",
        "manipulation",
        "mobile_manipulation",
        "custom"
      ]
    },
    "units": {
      "type": "object",
      "additionalProperties": false,
      "required": [
        "length",
        "time",
        "angle",
        "mass",
        "force",
        "torque"
      ],
      "properties": {
        "length": {
          "const": "m"
        },
        "time": {
          "const": "s"
        },
        "angle": {
          "const": "rad"
        },
        "mass": {
          "const": "kg"
        },
        "force": {
          "const": "N"
        },
        "torque": {
          "const": "N*m"
        }
      }
    },
    "world": {
      "type": "object",
      "additionalProperties": false,
      "required": [
        "world_id",
        "minimum_version",
        "manifest"
      ],
      "properties": {
        "world_id": {
          "$ref": "#/$defs/identifier"
        },
        "minimum_version": {
          "type": "integer",
          "minimum": 1,
          "maximum": 2147483647
        },
        "manifest": {
          "$ref": "#/$defs/artifactReference"
        }
      }
    },
    "robot_profile": {
      "$ref": "#/$defs/artifactReference"
    },
    "world_frame": {
      "$ref": "#/$defs/identifier"
    },
    "objective": {
      "type": "string",
      "minLength": 1,
      "maxLength": 2048
    },
    "start_state": {
      "type": "object",
      "additionalProperties": false,
      "required": [
        "pose",
        "state_artifact"
      ],
      "properties": {
        "pose": {
          "$ref": "#/$defs/pose"
        },
        "state_artifact": {
          "oneOf": [
            {
              "type": "null"
            },
            {
              "$ref": "#/$defs/artifactReference"
            }
          ]
        }
      }
    },
    "goals": {
      "type": "array",
      "minItems": 1,
      "maxItems": 4096,
      "items": {
        "type": "object",
        "additionalProperties": false,
        "required": [
          "goal_id",
          "type",
          "region_id",
          "target_pose",
          "target_fraction",
          "tolerance_m",
          "required"
        ],
        "properties": {
          "goal_id": {
            "$ref": "#/$defs/identifier"
          },
          "type": {
            "enum": [
              "coverage_region",
              "reach_pose",
              "return_to_pose",
              "inspect_region",
              "manipulate_asset"
            ]
          },
          "region_id": {
            "oneOf": [
              {
                "type": "null"
              },
              {
                "$ref": "#/$defs/identifier"
              }
            ]
          },
          "target_pose": {
            "oneOf": [
              {
                "type": "null"
              },
              {
                "$ref": "#/$defs/pose"
              }
            ]
          },
          "target_fraction": {
            "oneOf": [
              {
                "type": "null"
              },
              {
                "$ref": "#/$defs/fraction"
              }
            ]
          },
          "tolerance_m": {
            "oneOf": [
              {
                "type": "null"
              },
              {
                "$ref": "#/$defs/nonNegativeFinite"
              }
            ]
          },
          "required": {
            "type": "boolean"
          }
        }
      }
    },
    "constraints": {
      "type": "array",
      "maxItems": 4096,
      "items": {
        "type": "object",
        "additionalProperties": false,
        "required": [
          "constraint_id",
          "type",
          "region_id",
          "threshold",
          "severity"
        ],
        "properties": {
          "constraint_id": {
            "$ref": "#/$defs/identifier"
          },
          "type": {
            "enum": [
              "no_entry",
              "keep_inside",
              "speed_limit",
              "clearance",
              "contact_limit",
              "force_limit",
              "torque_limit",
              "energy_limit",
              "custom"
            ]
          },
          "region_id": {
            "oneOf": [
              {
                "type": "null"
              },
              {
                "$ref": "#/$defs/identifier"
              }
            ]
          },
          "threshold": {
            "oneOf": [
              {
                "type": "null"
              },
              {
                "$ref": "#/$defs/measurement"
              }
            ]
          },
          "severity": {
            "enum": [
              "advisory",
              "soft",
              "hard",
              "emergency"
            ]
          }
        }
      }
    },
    "failure_criteria": {
      "type": "array",
      "minItems": 1,
      "maxItems": 4096,
      "items": {
        "type": "object",
        "additionalProperties": false,
        "required": [
          "criterion_id",
          "type",
          "threshold",
          "severity"
        ],
        "properties": {
          "criterion_id": {
            "$ref": "#/$defs/identifier"
          },
          "type": {
            "enum": [
              "collision",
              "timeout",
              "out_of_bounds",
              "goal_missed",
              "sensor_failure",
              "safety_limit",
              "custom"
            ]
          },
          "threshold": {
            "oneOf": [
              {
                "type": "null"
              },
              {
                "$ref": "#/$defs/measurement"
              }
            ]
          },
          "severity": {
            "enum": [
              "soft",
              "hard",
              "emergency"
            ]
          }
        }
      }
    },
    "metrics": {
      "type": "array",
      "minItems": 1,
      "maxItems": 4096,
      "items": {
        "type": "object",
        "additionalProperties": false,
        "required": [
          "metric_id",
          "unit",
          "direction",
          "aggregation",
          "success_threshold",
          "required"
        ],
        "properties": {
          "metric_id": {
            "$ref": "#/$defs/identifier"
          },
          "unit": {
            "$ref": "#/$defs/unit"
          },
          "direction": {
            "enum": [
              "lower_is_better",
              "higher_is_better",
              "target"
            ]
          },
          "aggregation": {
            "enum": [
              "sum",
              "mean",
              "maximum",
              "minimum",
              "final",
              "fraction",
              "boolean"
            ]
          },
          "success_threshold": {
            "$ref": "#/$defs/measurement"
          },
          "required": {
            "type": "boolean"
          }
        }
      }
    },
    "task_envelope": {
      "type": "object",
      "additionalProperties": false,
      "required": [
        "maximum_duration_s",
        "maximum_linear_speed_m_s",
        "maximum_angular_speed_rad_s",
        "minimum_clearance_m",
        "environment_conditions"
      ],
      "properties": {
        "maximum_duration_s": {
          "$ref": "#/$defs/positiveFinite"
        },
        "maximum_linear_speed_m_s": {
          "$ref": "#/$defs/nonNegativeFinite"
        },
        "maximum_angular_speed_rad_s": {
          "$ref": "#/$defs/nonNegativeFinite"
        },
        "minimum_clearance_m": {
          "$ref": "#/$defs/nonNegativeFinite"
        },
        "environment_conditions": {
          "type": "array",
          "minItems": 1,
          "maxItems": 128,
          "items": {
            "type": "string",
            "minLength": 1,
            "maxLength": 1024
          }
        }
      }
    },
    "requirements": {
      "type": "object",
      "additionalProperties": false,
      "required": [
        "world_readiness",
        "world_authorities",
        "robot_profile_status",
        "physical_asset_tier",
        "runtime_capabilities"
      ],
      "properties": {
        "world_readiness": {
          "type": "array",
          "minItems": 1,
          "maxItems": 16,
          "uniqueItems": true,
          "items": {
            "enum": [
              "visual",
              "metric",
              "collision",
              "semantic",
              "navigation",
              "physics"
            ]
          }
        },
        "world_authorities": {
          "type": "array",
          "minItems": 1,
          "maxItems": 128,
          "uniqueItems": true,
          "items": {
            "$ref": "#/$defs/identifier"
          }
        },
        "robot_profile_status": {
          "enum": [
            "proposal",
            "validated",
            "promoted"
          ]
        },
        "physical_asset_tier": {
          "oneOf": [
            {
              "type": "null"
            },
            {
              "enum": [
                "C0",
                "C1",
                "C2",
                "C3",
                "C4",
                "C5"
              ]
            }
          ]
        },
        "runtime_capabilities": {
          "type": "array",
          "maxItems": 256,
          "uniqueItems": true,
          "items": {
            "$ref": "#/$defs/identifier"
          }
        }
      }
    },
    "authority": {
      "$ref": "#/$defs/authority"
    },
    "provenance": {
      "$ref": "#/$defs/provenance"
    }
  },
  "$defs": {
    "identifier": {
      "type": "string",
      "pattern": "^[A-Za-z0-9][A-Za-z0-9._-]{0,127}$"
    },
    "timestamp": {
      "type": "string",
      "pattern": "^\\d{4}-\\d{2}-\\d{2}T\\d{2}:\\d{2}:\\d{2}(?:\\.\\d+)?Z$"
    },
    "finiteNumber": {
      "type": "number",
      "minimum": -1000000000000,
      "maximum": 1000000000000
    },
    "nonNegativeFinite": {
      "type": "number",
      "minimum": 0,
      "maximum": 1000000000000
    },
    "positiveFinite": {
      "type": "number",
      "exclusiveMinimum": 0,
      "maximum": 1000000000000
    },
    "fraction": {
      "type": "number",
      "minimum": 0,
      "maximum": 1
    },
    "vector3": {
      "type": "array",
      "minItems": 3,
      "maxItems": 3,
      "items": {
        "$ref": "#/$defs/finiteNumber"
      }
    },
    "quaternion": {
      "type": "array",
      "minItems": 4,
      "maxItems": 4,
      "items": {
        "type": "number",
        "minimum": -1,
        "maximum": 1
      }
    },
    "unit": {
      "enum": [
        "m",
        "s",
        "rad",
        "kg",
        "N",
        "N*m",
        "m/s",
        "m/s^2",
        "rad/s",
        "dimensionless",
        "count"
      ]
    },
    "sha256": {
      "type": "string",
      "pattern": "^sha256:[0-9a-f]{64}$"
    },
    "safeRelativePath": {
      "type": "string",
      "minLength": 1,
      "maxLength": 1024,
      "pattern": "^[^\\u0000]+$",
      "not": {
        "anyOf": [
          {
            "pattern": "^/"
          },
          {
            "pattern": "\\\\"
          },
          {
            "pattern": "//|/$"
          },
          {
            "pattern": "^[A-Za-z][A-Za-z0-9+.-]*:"
          },
          {
            "pattern": "(^|/)\\.\\.?(/|$)"
          }
        ]
      }
    },
    "artifactReference": {
      "type": "object",
      "additionalProperties": false,
      "required": [
        "path",
        "sha256",
        "size_bytes",
        "media_type"
      ],
      "properties": {
        "path": {
          "$ref": "#/$defs/safeRelativePath"
        },
        "sha256": {
          "$ref": "#/$defs/sha256"
        },
        "size_bytes": {
          "type": "integer",
          "minimum": 0,
          "maximum": 9007199254740991
        },
        "media_type": {
          "type": "string",
          "pattern": "^[a-z0-9][a-z0-9!#$&^_.+-]*/[a-z0-9][a-z0-9!#$&^_.+-]*$"
        }
      }
    },
    "pose": {
      "type": "object",
      "additionalProperties": false,
      "required": [
        "frame_id",
        "position_m",
        "rotation_xyzw"
      ],
      "properties": {
        "frame_id": {
          "$ref": "#/$defs/identifier"
        },
        "position_m": {
          "$ref": "#/$defs/vector3"
        },
        "rotation_xyzw": {
          "$ref": "#/$defs/quaternion"
        }
      }
    },
    "measurement": {
      "type": "object",
      "additionalProperties": false,
      "required": [
        "value",
        "unit",
        "uncertainty"
      ],
      "properties": {
        "value": {
          "$ref": "#/$defs/finiteNumber"
        },
        "unit": {
          "$ref": "#/$defs/unit"
        },
        "uncertainty": {
          "$ref": "#/$defs/nonNegativeFinite"
        }
      }
    },
    "authority": {
      "type": "object",
      "additionalProperties": false,
      "required": [
        "classification",
        "approved_for",
        "not_approved_for",
        "limitations"
      ],
      "properties": {
        "classification": {
          "enum": [
            "task_proposal",
            "simulation_validated_task",
            "real_world_validated_task",
            "external_validation_required"
          ]
        },
        "approved_for": {
          "type": "array",
          "maxItems": 128,
          "uniqueItems": true,
          "items": {
            "$ref": "#/$defs/identifier"
          }
        },
        "not_approved_for": {
          "type": "array",
          "minItems": 1,
          "maxItems": 128,
          "uniqueItems": true,
          "items": {
            "$ref": "#/$defs/identifier"
          }
        },
        "limitations": {
          "type": "array",
          "minItems": 1,
          "maxItems": 128,
          "items": {
            "type": "string",
            "minLength": 1,
            "maxLength": 1024
          }
        }
      }
    },
    "provenance": {
      "type": "object",
      "additionalProperties": false,
      "required": [
        "producer",
        "producer_version",
        "created_at",
        "source_sha256",
        "reviewer"
      ],
      "properties": {
        "producer": {
          "$ref": "#/$defs/identifier"
        },
        "producer_version": {
          "type": "string",
          "minLength": 1,
          "maxLength": 128
        },
        "created_at": {
          "$ref": "#/$defs/timestamp"
        },
        "source_sha256": {
          "$ref": "#/$defs/sha256"
        },
        "reviewer": {
          "$ref": "#/$defs/identifier"
        }
      }
    }
  }
}
